{
  "schema_version": "seqcolyte.spec.v1",
  "spec_id": "tenx_3p_v3",
  "assay": "10x Chromium Single Cell 3' Gene Expression",
  "chemistry_version": "v3/v3.1",
  "platform": "illumina",
  "platform_params": {
    "two_color_chemistry": true,
    "dark_base": "G",
    "polyA_base": "A",
    "index_scheme": "single",
    "i7_length": 8,
    "i5_length": null,
    "read_lengths": {
      "R1": 28,
      "R2": 90,
      "I1": 8
    }
  },
  "source_docs": [
    {
      "doc_id": "scg_10xChromium3",
      "title": "scg_lib_structs \u2014 10x Chromium Single Cell 3' Gene Expression",
      "url": "https://teichlab.github.io/scg_lib_structs/methods_html/10xChromium3.html",
      "path": "protocols/10xChromium3.html",
      "retrieved_date": "2026-07-07"
    },
    {
      "doc_id": "illumina_truseq",
      "title": "Illumina Adapter Sequences (doc #1000000002694) \u2014 TruSeq Read 1/Read 2 primers",
      "url": "https://support-docs.illumina.com/SHARE/AdapterSequences/Content/SHARE/AdapterSeq/TruSeq/SequencesTruSeq.htm",
      "path": null,
      "retrieved_date": null
    },
    {
      "doc_id": "illumina_adapters",
      "title": "Illumina P5/P7 flow-cell adapter sequences (doc #1000000002694)",
      "url": "https://teichlab.github.io/scg_lib_structs/data/illumina-adapter-sequences-1000000002694-14.pdf",
      "path": null,
      "retrieved_date": null
    },
    {
      "doc_id": "tenx_tso",
      "title": "10x Genomics \u2014 Template Switch Oligo (Cell Ranger GEX algorithm / KB)",
      "url": "https://www.10xgenomics.com/support/software/cell-ranger/latest/algorithms-overview/cr-gex-algorithm",
      "path": null,
      "retrieved_date": null
    },
    {
      "doc_id": "cellranger_gex",
      "title": "10x Cell Ranger GEX algorithm \u2014 R2 orientation, TSO(5')/poly-A(3') trimming",
      "url": "https://www.10xgenomics.com/support/software/cell-ranger/latest/algorithms-overview/cr-gex-algorithm",
      "path": null,
      "retrieved_date": null
    }
  ],
  "oligos": [
    {
      "oligo_id": "oligo_beads_oligo_dt",
      "name": "Beads-oligo-dT",
      "aliases": [],
      "role": "oligo",
      "kind": "assembled",
      "sequence": "CTACACGACGCTCTTCCGATCT[CELL_BARCODE:16][UMI:12]TTTTTTTTTTTTTTTTTTTTTTTTTTTTTTVN",
      "direction": "5_to_3",
      "components": [
        {
          "name": "cDNA forward primer",
          "sequence": "CTACACGACGCTCTTCCGATCT",
          "role": "primer"
        },
        {
          "name": "[CELL_BARCODE:16]",
          "sequence": "[CELL_BARCODE:16]",
          "role": "cell_barcode"
        },
        {
          "name": "[UMI:12]",
          "sequence": "[UMI:12]",
          "role": "umi"
        },
        {
          "name": "polyT",
          "sequence": "TTTTTTTTTTTTTTTTTTTTTTTTTTTTTTVN",
          "role": "polyT"
        }
      ],
      "provenance": "reagent",
      "derivation": null,
      "sequence_source": "parsed_scg_html",
      "evidence": [
        {
          "source_doc": "scg_10xChromium3",
          "locator": "Adapter and primer sequences",
          "verified_against": [
            "https://support-docs.illumina.com/SHARE/AdapterSequences/Content/SHARE/AdapterSeq/TruSeq/SequencesTruSeq.htm",
            "https://teichlab.github.io/scg_lib_structs/methods_html/10xChromium3.html"
          ]
        }
      ],
      "notes": null
    },
    {
      "oligo_id": "oligo_template_switching_oligo_tso",
      "name": "Template Switching Oligo (TSO)",
      "aliases": [],
      "role": "oligo",
      "kind": "assembled",
      "sequence": "AAGCAGTGGTATCAACGCAGAGTACATGGG",
      "direction": "5_to_3",
      "components": [
        {
          "name": "cDNA reverse primer",
          "sequence": "AAGCAGTGGTATCAACGCAGAG",
          "role": "primer"
        }
      ],
      "provenance": "reagent",
      "derivation": null,
      "sequence_source": "parsed_scg_html",
      "evidence": [
        {
          "source_doc": "scg_10xChromium3",
          "locator": "Adapter and primer sequences",
          "verified_against": [
            "https://www.10xgenomics.com/support/software/cell-ranger/latest/algorithms-overview/cr-gex-algorithm",
            "https://teichlab.github.io/scg_lib_structs/methods_html/10xChromium3.html"
          ]
        }
      ],
      "notes": "Terminal rGrGrG (riboguanosines); parsed as GGG."
    },
    {
      "oligo_id": "oligo_cdna_forward_primer",
      "name": "cDNA Forward primer",
      "aliases": [],
      "role": "primer",
      "kind": "single",
      "sequence": "CTACACGACGCTCTTCCGATCT",
      "direction": "5_to_3",
      "components": [],
      "provenance": "document",
      "derivation": null,
      "sequence_source": "parsed_scg_html",
      "evidence": [
        {
          "source_doc": "scg_10xChromium3",
          "locator": "Adapter and primer sequences",
          "verified_against": [
            "https://teichlab.github.io/scg_lib_structs/methods_html/10xChromium3.html"
          ]
        }
      ],
      "notes": null
    },
    {
      "oligo_id": "oligo_cdna_reverse_primer",
      "name": "cDNA Reverse primer",
      "aliases": [],
      "role": "primer",
      "kind": "single",
      "sequence": "AAGCAGTGGTATCAACGCAGAG",
      "direction": "5_to_3",
      "components": [],
      "provenance": "reagent",
      "derivation": null,
      "sequence_source": "parsed_scg_html",
      "evidence": [
        {
          "source_doc": "scg_10xChromium3",
          "locator": "Adapter and primer sequences",
          "verified_against": [
            "https://teichlab.github.io/scg_lib_structs/methods_html/10xChromium3.html"
          ]
        }
      ],
      "notes": "v3/v3.1/v4 variant."
    },
    {
      "oligo_id": "oligo_illumina_truseq_read_1_primer",
      "name": "Illumina TruSeq Read 1 primer",
      "aliases": [],
      "role": "primer",
      "kind": "assembled",
      "sequence": "ACACTCTTTCCCTACACGACGCTCTTCCGATCT",
      "direction": "5_to_3",
      "components": [
        {
          "name": "cDNA forward primer",
          "sequence": "CTACACGACGCTCTTCCGATCT",
          "role": "primer"
        }
      ],
      "provenance": "document",
      "derivation": null,
      "sequence_source": "parsed_scg_html",
      "evidence": [
        {
          "source_doc": "scg_10xChromium3",
          "locator": "Adapter and primer sequences",
          "verified_against": [
            "https://support-docs.illumina.com/SHARE/AdapterSequences/Content/SHARE/AdapterSeq/TruSeq/SequencesTruSeq.htm",
            "https://teichlab.github.io/scg_lib_structs/methods_html/10xChromium3.html"
          ]
        }
      ],
      "notes": null
    },
    {
      "oligo_id": "oligo_illumina_truseq_read_2_primer",
      "name": "Illumina TruSeq Read 2 primer",
      "aliases": [],
      "role": "primer",
      "kind": "single",
      "sequence": "GTGACTGGAGTTCAGACGTGTGCTCTTCCGATCT",
      "direction": "5_to_3",
      "components": [],
      "provenance": "document",
      "derivation": null,
      "sequence_source": "parsed_scg_html",
      "evidence": [
        {
          "source_doc": "scg_10xChromium3",
          "locator": "Adapter and primer sequences",
          "verified_against": [
            "https://support-docs.illumina.com/SHARE/AdapterSequences/Content/SHARE/AdapterSeq/TruSeq/SequencesTruSeq.htm",
            "https://teichlab.github.io/scg_lib_structs/methods_html/10xChromium3.html"
          ]
        }
      ],
      "notes": null
    },
    {
      "oligo_id": "oligo_truseq_adapter",
      "name": "TruSeq adapter",
      "aliases": [
        "TruSeq adapter forward",
        "TruSeq adapter reverse"
      ],
      "role": "adapter",
      "kind": "double_stranded",
      "sequence": null,
      "direction": "5_to_3",
      "components": [
        {
          "name": "TruSeq adapter forward",
          "sequence": "GATCGGAAGAGCACACGTCTGAACTCCAGTCA",
          "role": "forward_strand"
        },
        {
          "name": "TruSeq adapter reverse",
          "sequence": "TCTAGCCTTCTCG",
          "role": "reverse_strand"
        }
      ],
      "provenance": "document",
      "derivation": null,
      "sequence_source": "parsed_scg_html",
      "evidence": [
        {
          "source_doc": "scg_10xChromium3",
          "locator": "Adapter and primer sequences",
          "verified_against": []
        }
      ],
      "notes": "Double-stranded with a T overhang; v3/v3.1/v4 variant."
    },
    {
      "oligo_id": "oligo_library_pcr_primer_1",
      "name": "Library PCR primer 1",
      "aliases": [],
      "role": "primer",
      "kind": "assembled",
      "sequence": "AATGATACGGCGACCACCGAGATCTACACTCTTTCCCTACACGACGCTC",
      "direction": "5_to_3",
      "components": [
        {
          "name": "Illumina P5 adapter",
          "sequence": "AATGATACGGCGACCACCGAGATCTACAC",
          "role": "adapter"
        }
      ],
      "provenance": "document",
      "derivation": null,
      "sequence_source": "parsed_scg_html",
      "evidence": [
        {
          "source_doc": "scg_10xChromium3",
          "locator": "Adapter and primer sequences",
          "verified_against": [
            "https://teichlab.github.io/scg_lib_structs/data/illumina-adapter-sequences-1000000002694-14.pdf",
            "https://teichlab.github.io/scg_lib_structs/methods_html/10xChromium3.html"
          ]
        }
      ],
      "notes": null
    },
    {
      "oligo_id": "oligo_library_pcr_primer_2",
      "name": "Library PCR primer 2",
      "aliases": [],
      "role": "primer",
      "kind": "assembled",
      "sequence": "CAAGCAGAAGACGGCATACGAGAT[SAMPLE_INDEX:8]GTGACTGGAGTTCAGACGTGT",
      "direction": "5_to_3",
      "components": [
        {
          "name": "Illumina P7 adapter",
          "sequence": "CAAGCAGAAGACGGCATACGAGAT",
          "role": "adapter"
        },
        {
          "name": "[SAMPLE_INDEX:8]",
          "sequence": "[SAMPLE_INDEX:8]",
          "role": "sample_index"
        }
      ],